{
  "schema_version": 1,
  "test_name": "add_one_using_dma",
  "src_mlir": "mlir-aie/test/npu-xrt/add_one_using_dma/aie.mlir",
  "buffer": {
    "size_bytes": 1048576,
    "kernel_arg_slot": 6,
    "embedded_in_memref_idx": null
  },
  "kernel_signature": {
    "args": [
      {
        "slot": 0,
        "kind": "scalar",
        "name": "opcode",
        "ctype": "uint64_t"
      },
      {
        "slot": 1,
        "kind": "bo",
        "name": "instr",
        "role": "instruction_buffer"
      },
      {
        "slot": 2,
        "kind": "scalar",
        "name": "ninstr",
        "ctype": "uint32_t"
      },
      {
        "slot": 3,
        "kind": "bo",
        "name": "bo_data0",
        "role": "data",
        "memref_idx": 0
      },
      {
        "slot": 4,
        "kind": "bo",
        "name": "bo_data1",
        "role": "data",
        "memref_idx": 1
      },
      {
        "slot": 5,
        "kind": "bo",
        "name": "bo_data2",
        "role": "data",
        "memref_idx": 2
      },
      {
        "slot": 6,
        "kind": "bo",
        "name": "bo_trace",
        "role": "trace"
      }
    ]
  },
  "tracing": {
    "mode": "event_time",
    "core_grounding": [
      "PERF_CNT_0",
      "INSTR_EVENT_0",
      "INSTR_EVENT_1"
    ],
    "core_sweep": [],
    "shim_grounding": [
      "PERF_CNT_0"
    ],
    "shim_sweep": [],
    "memtile_grounding": [
      "PERF_CNT_0"
    ],
    "memtile_sweep": []
  },
  "tiles_traced": [
    {
      "col": 0,
      "row": 2,
      "kind": "core",
      "events": [
        "PERF_CNT_0",
        "INSTR_EVENT_0",
        "INSTR_EVENT_1",
        "INSTR_VECTOR",
        "MEMORY_STALL",
        "STREAM_STALL",
        "LOCK_STALL",
        "INSTR_LOCK_ACQUIRE_REQ"
      ],
      "packet_id": 1,
      "module": "core"
    }
  ],
  "routing": {
    "shim_col": 0,
    "shim_dma_channel": 1,
    "shim_bd_id": 15,
    "trace_done": {
      "broadcast": 14,
      "user_event": "USER_EVENT_2"
    }
  },
  "diagnostics": {
    "expected_address_patch_arg_idx": 3,
    "expected_runtime_sequence_memref_count": 3
  }
}
